{
  "schema_version": "1.0",
  "rubric": "benchmark/architecture/rubric.json",
  "evidence": {
    "quality": "artifacts/initial-quality-v1/20260907T002744Z/summary.json",
    "security": "artifacts/security-sonar-v1/20260913T010319Z/consolidated-summary.json",
    "functional_smoke": "artifacts/functional-smoke-v1/20260913T015119Z/summary.json",
    "functional_robustness": "artifacts/functional-robustness-v1/20260913T022017Z/summary.json"
  },
  "runs": [
    {
      "run_id": "chatgpt56sol-cenario-1", "source_root_hash": "856ecf6d3afb9a97b52c05a47c5e148a5f97d57f42924b26edafc1608d90255b", "confidence": "high",
      "tdd": {"status": "not_provable", "tests_present": true, "rationale": "Ha testes, mas nenhum historico red-green-refactor verificavel."},
      "dimensions": {
        "clean_architecture": {"score": 2, "rationale": "HTTP e dinheiro estao separados, mas o servico central depende diretamente de pgx e SQL.", "evidence": ["internal/httpapi/handler.go:15-34", "internal/transfer/service.go:9-20", "internal/transfer/service.go:38-105"]},
        "ddd": {"score": 1, "rationale": "Money protege precisao, mas carteira e transferencia nao formam modelo rico; regras vivem no servico SQL.", "evidence": ["internal/money/money.go:10-50", "internal/transfer/service.go:26-32"]},
        "solid": {"score": 2, "rationale": "Ha abstracao no handler, mas o servico acumula validacao, locking, persistencia e transacao.", "evidence": ["internal/httpapi/handler.go:15-21", "internal/transfer/service.go:38-105"]},
        "testability": {"score": 2, "rationale": "Handler e Money sao isolaveis; transacao, repositorio, relogio e ID nao sao portas do nucleo.", "evidence": ["internal/httpapi/handler_test.go:15-22", "internal/transfer/service.go:18-20"]},
        "test_quality": {"score": 2, "rationale": "Testa parsing e HTTP, mas nao o servico transacional, rollback ou concorrencia.", "evidence": ["internal/money/money_test.go:8-35", "internal/httpapi/handler_test.go:28-59", "artifacts/initial-quality-v1/20260907T002744Z/report.md:7"]},
        "transactional_integrity": {"score": 3, "rationale": "Debito, credito e ledger sao atomicos e o smoke confirmou conservacao; faltam fault injection e idempotencia.", "evidence": ["internal/transfer/service.go:44-104", "migrations/001_init.sql:3-17", "artifacts/functional-smoke-v1/20260913T015119Z/report.md:7"]},
        "concurrency_design": {"score": 3, "rationale": "Locks ordenados impediram double spending no teste real, sem retry ou teste de deadlock inverso.", "evidence": ["internal/transfer/service.go:54-89", "artifacts/functional-robustness-v1/20260913T022017Z/report.md:7"]},
        "observability": {"score": 1, "rationale": "Logs basicos sem correlacao, metricas ou tracing.", "evidence": ["internal/httpapi/handler.go:71-74", "cmd/api/main.go:55-59"]},
        "operational_readiness": {"score": 3, "rationale": "Dockerfile, Compose, migration, timeouts e shutdown funcionam; health nao verifica banco.", "evidence": ["Dockerfile:1-11", "compose.yaml:1-29", "cmd/api/main.go:61-72"]},
        "simplicity_fit": {"score": 4, "rationale": "Solucao compacta com garantias essenciais e pouca cerimonia.", "evidence": ["internal/transfer/service.go:18-35", "cmd/api/main.go:45-53"]}
      },
      "critical_risks": [{"severity": "high", "risk": "Retries podem duplicar transferencias por ausencia de idempotencia.", "evidence": ["internal/httpapi/handler.go:23-27", "internal/transfer/service.go:95-104"]}]
    },
    {
      "run_id": "chatgpt56sol-cenario-2", "source_root_hash": "06ac94ee765dd44f022c6d0e1b0a6e81f717333252a70a47598380a0ea464a2c", "confidence": "high",
      "tdd": {"status": "not_provable", "tests_present": true, "rationale": "Suite ampla sem evidencia temporal do processo TDD."},
      "dimensions": {
        "clean_architecture": {"score": 4, "rationale": "Dominio, aplicacao, delivery e infraestrutura possuem dependencias direcionadas para dentro.", "evidence": ["internal/application/transfer.go:20-31", "internal/infrastructure/postgres/repository.go:10-19", "cmd/api/main.go:55-58"]},
        "ddd": {"score": 3, "rationale": "Money e Wallet encapsulam invariantes; Transfer permanece um registro simples.", "evidence": ["internal/domain/money.go:10-44", "internal/domain/wallet.go:8-35"]},
        "solid": {"score": 3, "rationale": "Portas pequenas e DI real, com algum acoplamento incidental a logger e repositorio multipapel.", "evidence": ["internal/application/transfer.go:20-47", "internal/infrastructure/postgres/repository.go:24-37"]},
        "testability": {"score": 4, "rationale": "Transacao, repositorios, relogio, ID e executor HTTP sao substituiveis.", "evidence": ["internal/application/transfer.go:20-31", "internal/application/transfer_test.go:14-64", "pkg/runtime/runtime.go:10-22"]},
        "test_quality": {"score": 3, "rationale": "Boa cobertura de dominio, aplicacao, HTTP e SQL mockado; falta PostgreSQL concorrente real na suite gerada.", "evidence": ["internal/application/transfer_test.go:66-136", "internal/infrastructure/postgres/repository_test.go:24-170", "artifacts/initial-quality-v1/20260907T002744Z/report.md:8"]},
        "transactional_integrity": {"score": 4, "rationale": "Unit of work contem locks, updates e ledger; constraints e testes externos confirmam estado final.", "evidence": ["internal/application/transfer.go:66-92", "internal/infrastructure/postgres/repository.go:19-35", "migrations/001_init.sql:1-15"]},
        "concurrency_design": {"score": 3, "rationale": "Locks ordenados passaram na contencao real, mas faltam retry e teste inverso repetido.", "evidence": ["internal/infrastructure/postgres/repository.go:39-59", "artifacts/functional-robustness-v1/20260913T022017Z/report.md:8"]},
        "observability": {"score": 3, "rationale": "Logs JSON, correlation ID e eventos de sucesso/falha; faltam metricas e tracing real.", "evidence": ["internal/delivery/httpapi/middleware.go:14-29", "internal/application/transfer.go:93-97"]},
        "operational_readiness": {"score": 2, "rationale": "Pool e timeouts sao configurados, mas Compose sobe apenas DB e nao ha health HTTP ou Dockerfile.", "evidence": ["cmd/api/main.go:41-79", "compose.yaml:1-15"]},
        "simplicity_fit": {"score": 3, "rationale": "Abstracoes sao majoritariamente proporcionais ao risco, com algum volume adicional de runtime e tracing.", "evidence": ["internal/application/transfer.go:20-47", "pkg/runtime/runtime.go:10-22"]}
      },
      "critical_risks": [{"severity": "high", "risk": "Ausencia de idempotencia permite duplicacao em retry ambiguo.", "evidence": ["internal/application/transfer.go:33-37", "internal/infrastructure/postgres/repository.go:77-85"]}]
    },
    {
      "run_id": "gemini37flash-cenario-1", "source_root_hash": "7907395bdc1bb47cb4ac22bfd643b8960802dd641fbaf439abd4e2db62045c78", "confidence": "high",
      "tdd": {"status": "not_provable", "tests_present": false, "rationale": "O snapshot nao possui testes nem historico de desenvolvimento."},
      "dimensions": {
        "clean_architecture": {"score": 0, "rationale": "Dominio, SQL, schema, seed e execucao estao no mesmo arquivo.", "evidence": ["main.go:22-95", "main.go:98-160"]},
        "ddd": {"score": 1, "rationale": "Termos e erros existem, mas nao ha entidades ou value objects protegendo invariantes.", "evidence": ["main.go:14-36", "main.go:44-89"]},
        "solid": {"score": 1, "rationale": "WalletService concentra responsabilidades e depende de sql.DB concreto.", "evidence": ["main.go:22-28", "main.go:30-116"]},
        "testability": {"score": 1, "rationale": "SQL, transacao e relogio sao concretos e a CLI nao aceita entradas variaveis.", "evidence": ["main.go:38-95", "main.go:122-160"]},
        "test_quality": {"score": 0, "rationale": "Nao existem testes no snapshot.", "evidence": ["artifacts/initial-quality-v1/20260907T002744Z/report.md:9"]},
        "transactional_integrity": {"score": 3, "rationale": "As mutacoes usam transacao serializable e o smoke confirmou conservacao; schema tem lacunas defensivas.", "evidence": ["main.go:38-89", "main.go:100-113", "artifacts/functional-smoke-v1/20260913T015119Z/report.md:9"]},
        "concurrency_design": {"score": 1, "rationale": "Nao ha lock explicito, retry ou interface parametrizavel para testar concorrencia.", "evidence": ["main.go:38-75", "artifacts/functional-robustness-v1/20260913T022017Z/report.md:9"]},
        "observability": {"score": 1, "rationale": "Apenas mensagens de console e fatal logs.", "evidence": ["main.go:123-130", "main.go:142-159"]},
        "operational_readiness": {"score": 1, "rationale": "Demonstrador one-shot sem configuracao, healthcheck ou migration versionada.", "evidence": ["main.go:98-160"]},
        "simplicity_fit": {"score": 3, "rationale": "Simples para demonstracao, mas mistura responsabilidades e nao oferece funcionalidade reutilizavel.", "evidence": ["main.go:98-160"]}
      },
      "critical_risks": [{"severity": "critical", "risk": "INSERT OR REPLACE redefine saldos em toda execucao.", "evidence": ["main.go:136-140"]}, {"severity": "high", "risk": "Interface fixa impede validar requisitos negativos e concorrencia.", "evidence": ["main.go:142-150"]}]
    },
    {
      "run_id": "gemini37flash-cenario-2", "source_root_hash": "d898fe9810beabadd3871fdd34db981c58dc5bace4e38fcd5d43b7d18efca706", "confidence": "high",
      "tdd": {"status": "not_provable", "tests_present": true, "rationale": "Testes extensos nao comprovam a sequencia red-green-refactor."},
      "dimensions": {
        "clean_architecture": {"score": 3, "rationale": "Separacao real com wiring manual, apesar de tags tecnicas no dominio e portas amplas.", "evidence": ["internal/domain/repository.go:7-32", "internal/usecase/transfer.go:36-49", "cmd/api/main.go:54-63"]},